{
  "schemaVersion": 2,
  "status": "normalized-candidate",
  "contentId": "room.shell.residential_studio_2x2.v1",
  "assetType": "room_shell",
  "source": {
    "kind": "generator",
    "provenance": "Tools/AssetPipeline/asset_normalizer.py",
    "rawSourceFile": "test_room_shell_1791042714406.jpg",
    "rawSourceSha256": "5215293c0404ea2747d696e4dc63d4f5deb5a7376ab20d57b9e4c3d6e44398f5"
  },
  "metrics": {
    "cellWidth": 2,
    "cellHeight": 2,
    "pixelsPerUnit": 360.0,
    "pivot": {
      "x": 0.5,
      "y": 0.5
    },
    "pixelBounds": {
      "width": 360,
      "height": 511
    }
  },
  "behavior": {
    "heightClass": "medium",
    "collisionMask": "none",
    "interactionPoints": [],
    "compatibleThemes": [
      "residential",
      "office",
      "commercial"
    ]
  },
  "rendering": {
    "sortingLayer": "Backdrops",
    "nineSliceBorder": {
      "left": 32,
      "bottom": 32,
      "right": 32,
      "top": 32
    }
  }
}